{
  "name": "ubiquitous-language",
  "description": "Extract a DDD-style ubiquitous language glossary from the current conversation, flagging ambiguities and proposing canonical terms. Saves to UBIQUITOUS_LANGUAGE.md. Use when user wants to define domain terms, build a glossary, harden terminology, create a ubiquitous language, or mentions \"domain model\" or \"DDD\".",
  "author": "mattpocock",
  "tags": ["ddd", "glossary", "documentation"]
}
