{
  "name": "polish-patterns",
  "description": "Copy-ready React+TypeScript implementations of UI polish patterns — token-driven theming with light/dark + density toggles, focus-return modal hooks, skeleton loaders, toast-with-undo, inline ARIA validation, drawer motion, first-run setup, and a small Icon component. A launchpad of concrete code that complements ui-ux-pro-max's design rules; pair the two when you have a rule to satisfy and want a working starting point.",
  "tags": [
    "typescript",
    "accessibility",
    "theming",
    "patterns",
    "electron",
    "shortcuts"
  ],
  "version": "0.1.0",
  "author": "Tyler-Reagan"
}
